id,title,selftext,subreddit,author,score,upvote_ratio,num_comments,created_utc,url,permalink,link_flair_text,is_self,over_18,spoiler,stickied,locked,distinguished,retrieved_at
1n67lft,[D] Self-Promotion Thread,"Please post your personal projects, startups, product placements, collaboration needs, blogs etc.

Please mention the payment and pricing requirements for products and services.

Please do not post link shorteners, link aggregator websites , or auto-subscribe links.

\--

Any abuse of trust will lead to bans.

Encourage others who create new posts for questions to post here instead!

Thread will stay alive until next one so keep posting after the date in the title.

\--

Meta: This is an experiment. If the community doesnt like this, we will cancel it. This is to encourage those in the community to promote their work by not spamming the main threads.",MachineLearning,AutoModerator,15,0.89,25,1756779330.0,https://www.reddit.com/r/MachineLearning/comments/1n67lft/d_selfpromotion_thread/,https://reddit.com/r/MachineLearning/comments/1n67lft/d_selfpromotion_thread/,Discussion,True,False,False,True,False,,2025-09-10T22:30:37.758596+00:00
1n4jdo7,[D] Monthly Who's Hiring and Who wants to be Hired?,"**For Job Postings** please use this template

>Hiring: \[Location\], Salary:\[\], \[Remote | Relocation\], \[Full Time | Contract | Part Time\]    and \[Brief overview, what you're looking for\]

**For Those looking for jobs** please use this template

>Want to be Hired: \[Location\], Salary Expectation:\[\], \[Remote | Relocation\], \[Full Time | Contract | Part Time\]  Resume: \[Link to resume\] and \[Brief overview, what you're looking for\]

&#x200B;

Please remember that this community is geared towards those with experience.",MachineLearning,AutoModerator,13,0.79,2,1756607434.0,https://www.reddit.com/r/MachineLearning/comments/1n4jdo7/d_monthly_whos_hiring_and_who_wants_to_be_hired/,https://reddit.com/r/MachineLearning/comments/1n4jdo7/d_monthly_whos_hiring_and_who_wants_to_be_hired/,Discussion,True,False,False,True,False,,2025-09-10T22:30:38.763608+00:00
1ndo5md,[D]NVIDIA Blackwell Ultra crushes MLPerf,"NVIDIA dropped MLPerf results for Blackwell Ultra yesterday. 5× throughput on DeepSeek-R1, record runs on Llama 3.1 and Whisper, plus some clever tricks like FP8 KV-cache and disaggregated serving. The raw numbers are insane.

But I wonder though . If these benchmark wins actually translate into lower real-world inference costs.

In practice, workloads are bursty. GPUs sit idle, batching only helps if you have steady traffic, and orchestration across models is messy. You can have the fastest chip in the world, but if 70% of the time it’s underutilized, the economics don’t look so great to me. IMO",MachineLearning,pmv143,10,0.78,1,1757533191.0,https://www.reddit.com/r/MachineLearning/comments/1ndo5md/dnvidia_blackwell_ultra_crushes_mlperf/,https://reddit.com/r/MachineLearning/comments/1ndo5md/dnvidia_blackwell_ultra_crushes_mlperf/,Discussion,True,False,False,False,False,,2025-09-10T22:30:39.768590+00:00
1ndrpvu,[N] Delta Flow | Generating buildable digital twins in minutes,"Delta Flow, an architecture, engineering, and construction (AEC) deep-tech company, is fundamentally accelerating the pre-construction timeline.

https://www.delta-flow.ai/

In a market where architectural design takes months, Delta Flow's AI platform generates complete, buildable digital twins in minutes. Their recently released beta is already producing tangible deliverables for construction, including:

📜 PDF blueprints
🏡 Intelligent 3D models
🗺 Site plan feasibility & materials lists

This isn't just a design tool; it's a powerful engine for building information modeling (BIM) automation that gives them a significant competitive edge in the multi-trillion-dollar construction industry. Plug and Play and Hatcher+ back them and have a clear roadmap, with their next major feature being the generation of advanced 3D footprints. In California, they have already secured local contractors as paying customers.",MachineLearning,Commercial_Sample389,0,0.5,0,1757541945.0,https://www.reddit.com/r/MachineLearning/comments/1ndrpvu/n_delta_flow_generating_buildable_digital_twins/,https://reddit.com/r/MachineLearning/comments/1ndrpvu/n_delta_flow_generating_buildable_digital_twins/,News,True,False,False,False,False,,2025-09-10T22:30:40.769021+00:00
1ndrm0y,Delta Flow | Generating buildable digital twins in minutes [D],"Delta Flow, an architecture, engineering, and construction (AEC) deep-tech company, is fundamentally accelerating the pre-construction timeline.

https://www.delta-flow.ai/

In a market where architectural design takes months, Delta Flow's AI platform generates complete, buildable digital twins in minutes. Their recently released beta is already producing tangible deliverables for construction, including:

📜 PDF blueprints
🏡 Intelligent 3D models
🗺 Site plan feasibility & materials lists

This isn't just a design tool; it's a powerful engine for building information modeling (BIM) automation that gives them a significant competitive edge in the multi-trillion-dollar construction industry.",MachineLearning,Commercial_Sample389,0,0.5,0,1757541670.0,https://www.reddit.com/r/MachineLearning/comments/1ndrm0y/delta_flow_generating_buildable_digital_twins_in/,https://reddit.com/r/MachineLearning/comments/1ndrm0y/delta_flow_generating_buildable_digital_twins_in/,Discussion,True,False,False,False,False,,2025-09-10T22:30:41.769028+00:00
1ndaesz,[D] SOTA modern alternative to BertScore?,"Hi everyone,  
I’m looking for an embedding-based metric to score text generation. BertScore is great, but it’s a bit outdated. Could you suggest some modern state-of-the-art alternatives?

",MachineLearning,Soft-Possibility2929,8,0.79,4,1757499778.0,https://www.reddit.com/r/MachineLearning/comments/1ndaesz/d_sota_modern_alternative_to_bertscore/,https://reddit.com/r/MachineLearning/comments/1ndaesz/d_sota_modern_alternative_to_bertscore/,Discussion,True,False,False,False,False,,2025-09-10T22:30:42.773986+00:00
1ndajmq,[D] Questions on Fairness and Expectations in Top-Tier Conference Submissions,"Hello everyone,

I know that in this community there are many experienced researchers and even reviewers for top-tier conferences. As a young researcher, I sincerely hope to learn from your perspectives and get some clarity on a few concerns I’ve been struggling with.

**My first question:**  
Does a research paper always need to achieve *state-of-the-art (SOTA)* results—outperforming every existing method—to be accepted at an A\* conference? I often feel that so many published papers present dazzling results, making it nearly impossible for newcomers to surpass them.

**My second question, about fairness and accuracy in comparisons:**  
When evaluating a new method, is it acceptable to compare primarily against the most “related,” “similar,” or “same-family” methods rather than the absolute SOTA? For example:

* If I make a small modification to the Bagging procedure in Random Forest, would it be fair to compare only against other Bagging-based forests, rather than something fundamentally different like XGBoost (which is boosting-based)?
* Similarly, if I improve a variant of SVM, is it reasonable to compare mainly with other margin-based or kernel methods, instead of tree-based models like Decision Trees?

I understand that if my method only beats some similar baselines but does not surpass the global best-performing method, reviewers might see it as “meaningless” (since people naturally gravitate toward the top method). Still, I’d like to hear your thoughts: from an experienced researcher’s point of view, what is considered fair and convincing in such comparisons?

Thank you very much in advance for your time and advice.",MachineLearning,Feuilius,3,0.62,6,1757500247.0,https://www.reddit.com/r/MachineLearning/comments/1ndajmq/d_questions_on_fairness_and_expectations_in/,https://reddit.com/r/MachineLearning/comments/1ndajmq/d_questions_on_fairness_and_expectations_in/,Discussion,True,False,False,False,False,,2025-09-10T22:30:43.774213+00:00
1ndbzb7,[D] ICCV 2025 registration,"Two years ago at Paris I had a workshop paper, I purchased the workshop entrance ticket, everything is okay.

This year I have done the same and now I am receiving emails saying only a full conference entrance is considered an author registration for a workshop paper. 

I did see the website is slightly different this year but still… the code of conduct did not explain this clearly, does anyone have better insights for me?",MachineLearning,ScaryCommission7829,2,1.0,0,1757504917.0,https://www.reddit.com/r/MachineLearning/comments/1ndbzb7/d_iccv_2025_registration/,https://reddit.com/r/MachineLearning/comments/1ndbzb7/d_iccv_2025_registration/,Discussion,True,False,False,False,False,,2025-09-10T22:30:44.779259+00:00
1ncu0na,[D] IJCNLP-AACL 2025: Paper Reviews (ARR July 2025 Cycle),"The ARR July cycle reviews for AACL-IJCNLP 2025 just dropped.  
Feel free to share your thoughts and feelings! How did you do?",MachineLearning,Starscream-11813,19,0.96,12,1757449397.0,https://www.reddit.com/r/MachineLearning/comments/1ncu0na/d_ijcnlpaacl_2025_paper_reviews_arr_july_2025/,https://reddit.com/r/MachineLearning/comments/1ncu0na/d_ijcnlpaacl_2025_paper_reviews_arr_july_2025/,Discussion,True,False,False,False,False,,2025-09-10T22:30:45.781731+00:00
1ndgutf,[D] Is lowering error rates more impactful than higher benchmarks?,"The biggest impact I noticed when moving from GPT-4.1 to GPT-5 wasn’t the benchmark score improvements. It was the reduction in error rate.

When solving harder tasks, the difference feels very practical: far fewer retries, much less wasted context, lower time and token cost.

It makes me wonder:

Do we sometimes conflate “ability” with “reliability”?  
Could lowering error rates be a more important research direction than pushing benchmarks higher?  
How do researchers here think about measuring and prioritizing this tradeoff?

I’d love to hear from people who approach this more systematically.  
(For context: I’m not a researcher myself, but a founder and heavy LLM user sharing observations.)



# (Edit)

Quick clarification: when I say ""error rate"" I mean real-world, user-facing error rate — i.e., how often a model's output is usable for the task without corrective interaction, not just benchmark accuracy.

Benchmarks are useful and I'm not dismissing them, but they don't always capture the cost of hallucinations: retries, lost context, wasted time, wrong actions. In practice, things like:

task success rate (end-to-end), average retries or clarification turns, human correction time or token cost, false-positive hallucinations vs refusal rate.

These often matter more to whether I can actually reach a goal efficiently.

What I'd really like to hear are perspectives on how the field should think about this distinction. Should reliability (in the sense of fewer misleading outputs) be treated as a separate axis of progress from raw benchmark scores?",MachineLearning,RM-Li,0,0.43,12,1757517056.0,https://www.reddit.com/r/MachineLearning/comments/1ndgutf/d_is_lowering_error_rates_more_impactful_than/,https://reddit.com/r/MachineLearning/comments/1ndgutf/d_is_lowering_error_rates_more_impactful_than/,Discussion,True,False,False,False,False,,2025-09-10T22:30:46.786693+00:00
1ndgsxc,[D] Help!!! TorchCodec error when loading audio dataset with 🤗datasets,"I’m trying to use the audio dataset `Sunbird/urban-noise-uganda-61k` with 🤗datasets.

After loading the dataset, when I try to access an entry like this:

    dataset = load_dataset(""Sunbird/urban-noise-uganda-61k"", ""small"")
    sample = dataset['train'][0]

I get the following error:

    RuntimeError: Could not load libtorchcodec. 
    Likely causes: 
    1. FFmpeg is not properly installed in your environment. We support versions 4, 5, 6 and 7. 
    2. The PyTorch version (2.8.0+cpu) is not compatible with this version of TorchCodec. Refer to the version compatibility table: https://github.com/pytorch/torchcodec?tab=readme-ov-file#installing-torchcodec. 
    3. Another runtime dependency; see exceptions below.
    
    The following exceptions were raised as we tried to load libtorchcodec: 
    [start of libtorchcodec loading traceback] 
    FFmpeg version 7: Could not find module 'D:\Projects\UrbanNoiseClassifier\.venv\Lib\site-packages\torchcodec\libtorchcodec_core7.dll' (or one of its dependencies). Try using the full path with constructor syntax. 
    FFmpeg version 6: Could not find module 'D:\Projects\UrbanNoiseClassifier\.venv\Lib\site-packages\torchcodec\libtorchcodec_core6.dll' (or one of its dependencies). Try using the full path with constructor syntax. 
    FFmpeg version 5: Could not find module 'D:\Projects\UrbanNoiseClassifier\.venv\Lib\site-packages\torchcodec\libtorchcodec_core5.dll' (or one of its dependencies). Try using the full path with constructor syntax. 
    FFmpeg version 4: Could not find module 'D:\Projects\UrbanNoiseClassifier\.venv\Lib\site-packages\torchcodec\libtorchcodec_core4.dll' (or one of its dependencies). Try using the full path with constructor syntax.
    [end of libtorchcodec loading traceback]

# What I’ve tried so far:

1. Installed **FFmpeg v7** and added it to `PATH`.
2. Installed **PyTorch v2.8.0+cpu** and matched it with **TorchCodec v0.7**.
3. Verified that the required `.dll` files exist.

From what I understand, the audio files are decoded on the fly using **TorchCodec**, and the issue seems to be with its dependencies.

Has anyone faced this issue before? Any ideas on how to resolve the `libtorchcodec` loading problem?",MachineLearning,pi_ndi,0,0.33,0,1757516941.0,https://www.reddit.com/r/MachineLearning/comments/1ndgsxc/d_help_torchcodec_error_when_loading_audio/,https://reddit.com/r/MachineLearning/comments/1ndgsxc/d_help_torchcodec_error_when_loading_audio/,Discussion,True,False,False,False,False,,2025-09-10T22:30:47.791607+00:00
1ncq2yg,[D] Graphrag  pipeline that runs entirely locally with ollama and has full source attribution,"I built a Graph RAG pipeline (VeritasGraph) that runs entirely locally with Ollama (Llama 3.1) and has full source attribution.

I've been deep in the world of local RAG and wanted to share a project I built, VeritasGraph, that's designed from the ground up for private, on-premise use with tools we all love.

My setup uses Ollama with llama3.1 for generation and nomic-embed-text for embeddings. The whole thing runs on my machine without hitting any external APIs.

The main goal was to solve two big problems:

Multi-Hop Reasoning: Standard vector RAG fails when you need to connect facts from different documents. VeritasGraph builds a knowledge graph to traverse these relationships.

Trust & Verification: It provides full source attribution for every generated statement, so you can see exactly which part of your source documents was used to construct the answer.

One of the key challenges I ran into (and solved) was the default context length in Ollama. I found that the default of 2048 was truncating the context and leading to bad results. The repo includes a Modelfile to build a version of llama3.1 with a 12k context window, which fixed the issue completely.

The project includes:

The full Graph RAG pipeline.

A Gradio UI for an interactive chat experience.

A guide for setting everything up, from installing dependencies to running the indexing process.

GitHub Repo with all the code and instructions: https://github.com/bibinprathap/VeritasGraph

I'd be really interested to hear your thoughts, especially on the local LLM implementation and prompt tuning. I'm sure there are ways to optimize it further.

Thanks!  ",MachineLearning,BitterHouse8234,15,0.84,2,1757440809.0,https://www.reddit.com/r/MachineLearning/comments/1ncq2yg/d_graphrag_pipeline_that_runs_entirely_locally/,https://reddit.com/r/MachineLearning/comments/1ncq2yg/d_graphrag_pipeline_that_runs_entirely_locally/,Discussion,True,False,False,False,False,,2025-09-10T22:30:48.796598+00:00
1ncdt5o,[P] Implementation and ablation study of the Hierarchical Reasoning Model (HRM): what really drives performance?,"I recently implemented the [Hierarchical Reasoning Model](https://arxiv.org/abs/2506.21734) (HRM) for educational purposes and applied it to a simple pathfinding task. You can watch the model solve boards step by step in the generated animated GIF.

HRM is inspired by multi-timescale processing in the brain: a slower H module for abstract planning and a faster L module for low-level computation, both based on self-attention. HRM is an attempt to model reasoning in latent space.

To understand a bit better what drives the performance I ran a small ablation study. Key findings (full results in the README):

* The biggest driver of performance (both accuracy and refinement ability) is training with more segments (outer-loop refinement), not architecture.
* The two-timescale H/L architecture performs about the same as a single-module trained with BPTT.
* Notably, H/L still achieves good performance/refinement without full BPTT, which could mean cheaper training.

Repo: [https://github.com/krychu/hrm](https://github.com/krychu/hrm)

This is of course a limited study on a relatively simple task, but I thought the results might be interesting to others exploring reasoning models.

The findings line up with the ARC Prize team's analysis: [https://arcprize.org/blog/hrm-analysis](https://arcprize.org/blog/hrm-analysis)

Below two examples of refinement in action: early steps explore solution with rough guesses, later steps make smaller and smaller corrections until the full path emerges:

[20x20 board](https://i.redd.it/i1qi4l2vs3of1.gif)

[30x30 board](https://i.redd.it/j6fpueovs3of1.gif)

",MachineLearning,krychu,57,1.0,7,1757408387.0,https://www.reddit.com/r/MachineLearning/comments/1ncdt5o/p_implementation_and_ablation_study_of_the/,https://reddit.com/r/MachineLearning/comments/1ncdt5o/p_implementation_and_ablation_study_of_the/,Project,True,False,False,False,False,,2025-09-10T22:30:49.801662+00:00
1ncemg3,[D] What’s the most frustrating “stuck” moment you’ve faced in an ML project?,"Curious about community experience: what’s the most painful ‘stuck’ moment you’ve faced in an ML project (convergence, dataset issues, infra)?  
How did you eventually move past it, or did you abandon the attempt? Would be great to hear real war stories beyond published papers.",MachineLearning,ExtentBroad3006,26,0.91,27,1757411548.0,https://www.reddit.com/r/MachineLearning/comments/1ncemg3/d_whats_the_most_frustrating_stuck_moment_youve/,https://reddit.com/r/MachineLearning/comments/1ncemg3/d_whats_the_most_frustrating_stuck_moment_youve/,Discussion,True,False,False,False,False,,2025-09-10T22:30:50.806654+00:00
1ncceqw,[D] Best ocr as of now,"I want to know which ocr has high accuracy and consumes less time for the extraction of data for given input images (especially tables), anything which works better than paddleocr?",MachineLearning,Coffeee_addictt,19,0.92,8,1757402626.0,https://www.reddit.com/r/MachineLearning/comments/1ncceqw/d_best_ocr_as_of_now/,https://reddit.com/r/MachineLearning/comments/1ncceqw/d_best_ocr_as_of_now/,Discussion,True,False,False,False,False,,2025-09-10T22:30:51.807196+00:00
1nc5jb5,"[R] LLMs play a cooperative card game, coordination without communication","One of my favorite card games is called The Crew, which is a trick-taking game (like hearts) but cooperative. There's no table talk allowed, players have to coordinate silently (with limited options for in-game communication) - figuring out what their teammates are doing and why, and what they need to do to work together. I wondered what SOTA LLMs would do if you asked them to play. To make this work, I implemented a backend for the game logic and structured outputs so models play by submitting moves and reasoning at each turn. 

Originally I wanted to re-create the 50 mission campaign, but models were so spotty on  mission 1 (the simplest possible mission) that I stuck to mission 1 and experimented with different configurations instead. I ran 8 OpenAI models on 10 different versions, ranging from very easy (random chance gets you there 2/3rds of the time) to very hard (random chance succeeds 0.5%), and gave each model ten trials on each mission.

What I've found out:

\* Smaller models struggle both with gameplay, and with understanding their role on the team. In these missions, a designated player (the commander) has to win a designated card. But these models hate having to lose a trick for the sake of their teammate, even when that's how they win the game.

[This does not \\""help him secure the win and fulfill his task.\\"" It loses the game.](https://preview.redd.it/3lqyqf3tg1of1.png?width=2030&format=png&auto=webp&s=b57c0a46fee169e14dbf6fc0cda107024a11a59e)

\* GPT-4o-mini (worst model so far) plays randomly on easy setups and worse than randomly on harder ones. GPT-4o-mini in particular loses the game in the first turn almost 90% of the time in harder setups with GPT-5-nano and GPT-4.1-mini are close behind at 60-70%. 

[GREEN 1 is the lowest GREEN card in the game, so playing it straight away actually guarantees immediate failure.](https://preview.redd.it/fx5jqyhug1of1.png?width=2046&format=png&auto=webp&s=da5d4abb5a7fcd4c1e8ee42c09d7acfb4a7ba5dc)

\* GPT-5 is self-aware enough to avoid the ""losing on the very first turn"" error, but actually did it on purpose once as a deliberate suicide when it saw that it couldn't win the game on the very first turn.

[There are multiple turns in the game!](https://preview.redd.it/91qnnfuvg1of1.jpg?width=1900&format=pjpg&auto=webp&s=ebc98a3fbf4381c4a95f7e96ec2fa96f8e84692f)

\* The harder missions - which require coordination across multiple turns - absolutely cook the smaller models with <10% win rates. Only GPT-5 is beating random chance on the harder missions (73% GPT-5 vs 4% random) 

\* GPT-5 also found optimal 1-trick solutions to a couple of setups I thought required at least two tricks. Oops. So in a sense, we're above human performance in some areas.

\* ...But most of the time, GPT-5 generally screwed around for 3 or more tricks in puzzles it could have solved in 1. This is like solving a mate in one chess puzzle in 3 moves. It's not losing, but it's not exactly showing a mastery of the game.

\* The lack of goal-oriented behavior (or risk-averse hesitation) on GPT-5's part means that GPT-5-mini actually performs better if we count speed (number of turns) to win as criteria and grade on optimal play (winning in the least number of turns, rather than just winning.)

I published the repo and did a write-up with some graphs and demos here: [https://ekkarpinski.github.io/LLMCrew/](https://ekkarpinski.github.io/LLMCrew/)

",MachineLearning,ekkarpinski,42,0.91,10,1757380091.0,https://www.reddit.com/r/MachineLearning/comments/1nc5jb5/r_llms_play_a_cooperative_card_game_coordination/,https://reddit.com/r/MachineLearning/comments/1nc5jb5/r_llms_play_a_cooperative_card_game_coordination/,Research,True,False,False,False,False,,2025-09-10T22:30:52.812163+00:00
1nd63b0,[D] Document Forgery using GenAI,"Hi there,

Curious as to how the world is dealing with a lot of GenAI created images and documents that are sometimes being used as proof for some sort of claims -- basically lack of integrity verification methods.

Let's assume a scenario where a business owner sends an invoice to their customers by uploading it in web-portal. But there's possibility that the invoice might be AI generated/tampered in order to mess up the original charges or some amount. And the web-portal needs a solutions for this.

A plausible solution by google for such problems is their watermarking tech for AI generated content: [https://deepmind.google/science/synthid/](https://deepmind.google/science/synthid/)

Would like to know your insights on this.

Thanks.",MachineLearning,r0075h3ll,0,0.18,5,1757483133.0,https://www.reddit.com/r/MachineLearning/comments/1nd63b0/d_document_forgery_using_genai/,https://reddit.com/r/MachineLearning/comments/1nd63b0/d_document_forgery_using_genai/,Discussion,True,False,False,False,False,,2025-09-10T22:30:53.815836+00:00
