id,title,selftext,subreddit,author,score,upvote_ratio,num_comments,created_utc,url,permalink,link_flair_text,is_self,over_18,spoiler,stickied,locked,distinguished,retrieved_at
1ndjq1c,Rand Paul Reveals Venezuela Boat Attack Was a Drone Strike. The senator told The Intercept the attack defied rules of engagement and came from a drone.,,technology,indig0sixalpha,15764,0.97,387,1757523296.0,https://theintercept.com/2025/09/10/trump-venezuela-boat-attack-drone,https://reddit.com/r/technology/comments/1ndjq1c/rand_paul_reveals_venezuela_boat_attack_was_a/,Politics,False,False,False,False,False,,2025-09-10T22:32:21.604362+00:00
1ndlv04,Dead Internet Theory Lives: One Out of Three of You Is a Bot,,technology,hety0p,1827,0.97,295,1757527972.0,https://gizmodo.com/dead-internet-theory-lives-one-out-of-three-of-you-is-a-bot-2000656924,https://reddit.com/r/technology/comments/1ndlv04/dead_internet_theory_lives_one_out_of_three_of/,Artificial Intelligence,False,False,False,False,False,,2025-09-10T22:32:22.609456+00:00
1nddbx0,Reddit is dropping subscriber counts on subreddits. ﻿Users will now see seven-day metrics that track active visitors and contributions instead.,,technology,indig0sixalpha,4290,0.95,623,1757508658.0,https://www.theverge.com/news/775524/reddit-subreddit-member-count-vistors-contributions,https://reddit.com/r/technology/comments/1nddbx0/reddit_is_dropping_subscriber_counts_on/,Social Media,False,False,False,False,False,,2025-09-10T22:32:23.614456+00:00
1ndher0,Leaked Ice document shows worker detained in Hyundai raid had valid visa,,technology,esporx,2253,0.97,78,1757518280.0,https://www.theguardian.com/us-news/2025/sep/10/hyundai-factory-ice-raid-legal-visa,https://reddit.com/r/technology/comments/1ndher0/leaked_ice_document_shows_worker_detained_in/,Business,False,False,False,False,False,,2025-09-10T22:32:24.619454+00:00
1nd53ee,RFK Jr. Comes Up With New Possible Cause for Mass Shootings: Video Games,,technology,rezwenn,22729,0.93,3581,1757479562.0,https://www.thedailybeast.com/rfk-jr-comes-up-with-new-possible-cause-for-mass-shootings-video-games/,https://reddit.com/r/technology/comments/1nd53ee/rfk_jr_comes_up_with_new_possible_cause_for_mass/,Software,False,False,False,False,False,,2025-09-10T22:32:25.624468+00:00
1ndbdf1,Pfizer says this season’s COVID shot boosts immune responses fourfold,,technology,Wagamaga,3703,0.94,490,1757503002.0,https://arstechnica.com/health/2025/09/pfizer-reports-positive-covid-shot-results-despite-government-fueled-chaos/,https://reddit.com/r/technology/comments/1ndbdf1/pfizer_says_this_seasons_covid_shot_boosts_immune/,Biotechnology,False,False,False,False,False,,2025-09-10T22:32:26.629396+00:00
1ndk7r7,"AI vs. MAGA: Populists alarmed by Trump’s embrace of AI, Big Tech: AI “threatens the common man’s liberty,"" says GOP Sen. Josh Hawley.",,technology,ControlCAD,1140,0.97,50,1757524371.0,https://arstechnica.com/tech-policy/2025/09/ai-vs-maga-populists-alarmed-by-trumps-embrace-of-ai-big-tech/,https://reddit.com/r/technology/comments/1ndk7r7/ai_vs_maga_populists_alarmed_by_trumps_embrace_of/,Politics,False,False,False,False,False,,2025-09-10T22:32:27.634388+00:00
1ndfjvo,"‘Myth’: Most Drivers Don’t Rely On CarPlay As Much As You Think, BMW Says",,technology,DonkeyFuel,1868,0.89,1049,1757514068.0,https://insideevs.com/news/771817/apple-carplay-myth-navigation-bmw-ui-boss/,https://reddit.com/r/technology/comments/1ndfjvo/myth_most_drivers_dont_rely_on_carplay_as_much_as/,Transportation,False,False,False,False,False,,2025-09-10T22:32:28.639403+00:00
1ndbwan,"The Internet Will Be More Dead Than Alive Within 3 Years, Trend Shows | All signs point to a future internet where bot-driven interactions far outnumber human ones.",,technology,MetaKnowing,2318,0.97,223,1757504664.0,https://www.popularmechanics.com/science/a65997294/dead-internet-explained/,https://reddit.com/r/technology/comments/1ndbwan/the_internet_will_be_more_dead_than_alive_within/,Artificial Intelligence,False,False,False,False,False,,2025-09-10T22:32:29.644415+00:00
1ndau6o,"CBS Caves Again, Will No Longer Air Edited Interviews After Noem Whined About Cuts To Hers",,technology,chrisdh79,2556,0.97,111,1757501259.0,https://www.techdirt.com/2025/09/09/cbs-caves-again-will-no-longer-air-edited-interviews-after-noem-whined-about-cuts-to-hers/,https://reddit.com/r/technology/comments/1ndau6o/cbs_caves_again_will_no_longer_air_edited/,Business,False,False,False,False,False,,2025-09-10T22:32:30.646969+00:00
1ndciw2,Spotify adds lossless streaming after 8 years of teasing | Subscribers will be able to enjoy 24-bit / 44.1 kHz FLAC as part of their Premium plan.,,technology,chrisdh79,1795,0.95,381,1757506458.0,https://www.theverge.com/spotify/775189/spotify-lossless-streaming-flac-audio,https://reddit.com/r/technology/comments/1ndciw2/spotify_adds_lossless_streaming_after_8_years_of/,Software,False,False,False,False,False,,2025-09-10T22:32:31.647171+00:00
1ndcm5v,Switch modder who represented himself in piracy case ordered to pay Nintendo $2 million | An ill-fated stand against a company seasoned in piracy litigation,,technology,chrisdh79,1511,0.96,155,1757506707.0,https://www.techspot.com/news/109372-switch-modder-who-represented-himself-court-ordered-pay.html,https://reddit.com/r/technology/comments/1ndcm5v/switch_modder_who_represented_himself_in_piracy/,Society,False,False,False,False,False,,2025-09-10T22:32:32.648987+00:00
1ndjufh,The Shocking Far-Right Agenda Behind the Facial Recognition Tech Used by ICE and the FBI,,technology,Wagamaga,471,0.94,12,1757523570.0,https://www.motherjones.com/politics/2025/04/clearview-ai-immigration-ice-fbi-surveillance-facial-recognition-hoan-ton-that-hal-lambert-trump/,https://reddit.com/r/technology/comments/1ndjufh/the_shocking_farright_agenda_behind_the_facial/,Society,False,False,False,False,False,,2025-09-10T22:32:33.653984+00:00
1ndjdsq,"Tesla’s Dangerous Doors: When Teslas lose power, crashes can turn into deadly races against time.",,technology,rezwenn,478,0.91,145,1757522547.0,https://www.bloomberg.com/features/2025-tesla-dangerous-doors/?accessToken=eyJhbGciOiJIUzI1NiIsInR5cCI6IkpXVCJ9.eyJzb3VyY2UiOiJTdWJzY3JpYmVyR2lmdGVkQXJ0aWNsZSIsImlhdCI6MTc1NzUxMDE5MywiZXhwIjoxNzU4MTE0OTkzLCJhcnRpY2xlSWQiOiJUMkQ3T1NHUEw0MVMwMCIsImJjb25uZWN0SWQiOiIzNDVFQTA0MjNBMUQ0NTI2QjY1QkNBNUZDRUJGQThGNiJ9.3NTEL91Jne1yzcYwHrNNW9swvF-P0Bc9TCUQldoAjLk,https://reddit.com/r/technology/comments/1ndjdsq/teslas_dangerous_doors_when_teslas_lose_power/,Transportation,False,False,False,False,False,,2025-09-10T22:32:34.658903+00:00
1ndbxtk,"The U.S. economy actually grew by nearly a million fewer jobs than previously thought, and it shows 'AI is automating away tech jobs,' economist says",,technology,MetaKnowing,1008,0.9,151,1757504790.0,https://fortune.com/2025/09/09/bls-revisions-nearly-a-million-fewer-jobs-ai-automating-tech/,https://reddit.com/r/technology/comments/1ndbxtk/the_us_economy_actually_grew_by_nearly_a_million/,Artificial Intelligence,False,False,False,False,False,,2025-09-10T22:32:35.663780+00:00
1ndq7ow,Cuba hit with fifth blackout in less than a year with 10m people in the dark,,technology,RebelStrategist,138,0.96,13,1757538142.0,https://www.theguardian.com/world/2025/sep/10/cuba-electricity-power-blackout,https://reddit.com/r/technology/comments/1ndq7ow/cuba_hit_with_fifth_blackout_in_less_than_a_year/,Energy,False,False,False,False,False,,2025-09-10T22:32:36.668792+00:00
1ndckn2,Ted Cruz Wants to Help AI Companies Duck Regulations | Move fast and get permission to break stuff.,,technology,chrisdh79,612,0.95,59,1757506594.0,https://gizmodo.com/ted-cruz-wants-to-help-ai-companies-duck-regulations-2000656377,https://reddit.com/r/technology/comments/1ndckn2/ted_cruz_wants_to_help_ai_companies_duck/,Politics,False,False,False,False,False,,2025-09-10T22:32:37.669002+00:00
1ndjm2o,Teenage Boy in China Suffers Stroke After Hours on Phone with Bent Neck,,technology,Forward-Answer-4407,244,0.89,33,1757523050.0,https://www.timesnownews.com/health/teenage-boy-in-china-suffers-stroke-after-hours-on-phone-with-bent-neck-article-152703659,https://reddit.com/r/technology/comments/1ndjm2o/teenage_boy_in_china_suffers_stroke_after_hours/,Society,False,False,False,False,False,,2025-09-10T22:32:38.674093+00:00
1ncxcfg,Moderna CEO Responds to RFK Jr.’s Crusade Against the Covid-19 Vaccine,,technology,DonkeyFuel,6265,0.97,222,1757457359.0,https://www.wired.com/story/moderna-ceo-responds-to-rfk-jrs-crusade-against-the-covid-19-vaccine/,https://reddit.com/r/technology/comments/1ncxcfg/moderna_ceo_responds_to_rfk_jrs_crusade_against/,Politics,False,False,False,False,False,,2025-09-10T22:32:39.676482+00:00
1ndficc,BMW Says Europe's Gas Engine Ban 'Can Kill an Industry',,technology,DonkeyFuel,290,0.84,255,1757513972.0,https://www.motor1.com/news/771782/bmw-warns-2035-gas-engine-ban-kill-industry/,https://reddit.com/r/technology/comments/1ndficc/bmw_says_europes_gas_engine_ban_can_kill_an/,Transportation,False,False,False,False,False,,2025-09-10T22:32:40.681461+00:00
1ndkl7l,Tesla Wants Out of the Car Business,,technology,TripleShotPls,120,0.79,106,1757525187.0,https://www.theatlantic.com/technology/archive/2025/09/tesla-elon-musk-master-plan-robotaxi/684122/,https://reddit.com/r/technology/comments/1ndkl7l/tesla_wants_out_of_the_car_business/,Transportation,False,False,False,False,False,,2025-09-10T22:32:41.682863+00:00
1ndbu3y,"The women in love with AI companions: ‘I vowed to my chatbot that I wouldn’t leave him’ | Experts are concerned about people emotionally depending on AI, but these women say their digital companions are misunderstood",,technology,MetaKnowing,313,0.85,195,1757504482.0,https://www.theguardian.com/technology/2025/sep/09/ai-chatbot-love-relationships,https://reddit.com/r/technology/comments/1ndbu3y/the_women_in_love_with_ai_companions_i_vowed_to/,Artificial Intelligence,False,False,False,False,False,,2025-09-10T22:32:42.686390+00:00
1ndr99w,"Rock found on Mars could be evidence of ancient life, NASA says",,technology,Efficient-Ruin-4713,51,0.94,8,1757540770.0,https://abcnews.go.com/Technology/rock-found-mars-evidence-ancient-life-nasa/story?id=125443932,https://reddit.com/r/technology/comments/1ndr99w/rock_found_on_mars_could_be_evidence_of_ancient/,Space,False,False,False,False,False,,2025-09-10T22:32:43.691377+00:00
1ndirq7,Turning to the sun: Solar growth in Central Europe exceeds all expectations as it quickly becomes the continent’s battery hub,,technology,upyoars,121,0.95,1,1757521235.0,https://ember-energy.org/latest-insights/turning-to-the-sun-solar-rise-in-central-europe/,https://reddit.com/r/technology/comments/1ndirq7/turning_to_the_sun_solar_growth_in_central_europe/,Energy,False,False,False,False,False,,2025-09-10T22:32:44.696373+00:00
1ndehfi,Apple raises iPhone Pro starting price in U.S. for first time since 2017,,technology,ControlCAD,177,0.86,150,1757511567.0,https://www.cnbc.com/2025/09/09/apple-iphone-price-pro-max-us.html,https://reddit.com/r/technology/comments/1ndehfi/apple_raises_iphone_pro_starting_price_in_us_for/,Business,False,False,False,False,False,,2025-09-10T22:32:45.696997+00:00
1ndl4ga,"With Cheap Chinese Solar, Developing Countries Leapfrog U.S. on Clean Energy",,technology,diacewrb,77,0.89,4,1757526357.0,https://e360.yale.edu/digest/china-clean-tech-developing-countries,https://reddit.com/r/technology/comments/1ndl4ga/with_cheap_chinese_solar_developing_countries/,Energy,False,False,False,False,False,,2025-09-10T22:32:46.701318+00:00
1nclz5f,Microsoft Is Officially Sending Employees Back to the Office,,technology,McFatty7,8824,0.94,960,1757431623.0,https://www.businessinsider.com/microsoft-send-employees-back-to-office-rto-remote-work-2025-9,https://reddit.com/r/technology/comments/1nclz5f/microsoft_is_officially_sending_employees_back_to/,Business,False,False,False,False,False,,2025-09-10T22:32:47.706289+00:00
1ndmzjc,"Africa could become 'renewable superpower', says UN head Guterres",,technology,upyoars,47,0.88,4,1757530517.0,https://www.france24.com/en/live-news/20250821-africa-could-become-renewable-superpower-says-guterres,https://reddit.com/r/technology/comments/1ndmzjc/africa_could_become_renewable_superpower_says_un/,Energy,False,False,False,False,False,,2025-09-10T22:32:48.708116+00:00
1ncnvoa,"The U.S. is losing thousands of manufacturing jobs, analysis finds",,technology,idkbruh653,5861,0.98,175,1757435922.0,https://www.cbsnews.com/news/jobs-manufacturing-trump-tariffs-economy/,https://reddit.com/r/technology/comments/1ncnvoa/the_us_is_losing_thousands_of_manufacturing_jobs/,Business,False,False,False,False,False,,2025-09-10T22:32:49.712859+00:00
1nctdfy,"HHS Asks All Employees to Start Using ChatGPT | Employees received an email with the subject line “AI Deployment,” which told them that ChatGPT would be rolled out for all employees at the agency. The deployment is being overseen by a former Palantir employee, who’s now Chief Information Officer.",,technology,Aggravating_Money992,2485,0.96,175,1757447986.0,https://www.404media.co/hhs-asks-all-employees-to-start-using-chatgpt/,https://reddit.com/r/technology/comments/1nctdfy/hhs_asks_all_employees_to_start_using_chatgpt/,Artificial Intelligence,False,False,False,False,False,,2025-09-10T22:32:50.717844+00:00
1ncg8xr,Donald Trump's Mass Deportation Agenda Has A Surprising Stakeholder: Bill Gates,,technology,zsreport,17652,0.84,1136,1757417145.0,https://www.huffpost.com/entry/bill-gates-trump-ice-signature-aviation_n_68acd96fe4b0d17ae21e7ec4,https://reddit.com/r/technology/comments/1ncg8xr/donald_trumps_mass_deportation_agenda_has_a/,Transportation,False,False,False,False,False,,2025-09-10T22:32:51.722066+00:00
1ndl8e5,Reddit is testing a way to read articles without leaving the app | A suite of new tools is geared toward news publishers and readers,,technology,Hrmbee,39,0.8,11,1757526595.0,https://www.theverge.com/news/775722/reddit-news-publishers-beta-articles-analytics,https://reddit.com/r/technology/comments/1ndl8e5/reddit_is_testing_a_way_to_read_articles_without/,Social Media,False,False,False,False,False,,2025-09-10T22:32:52.722484+00:00
1ndnky2,"CATL's Naxtra sodium-ion battery passes new national safety standards, ready for mass production",,technology,yogthos,26,0.83,2,1757531851.0,https://carnewschina.com/2025/09/08/catls-naxtra-sodium-ion-passes-new-national-safety-standards-ready-for-mass-production/,https://reddit.com/r/technology/comments/1ndnky2/catls_naxtra_sodiumion_battery_passes_new/,Energy,False,False,False,False,False,,2025-09-10T22:32:53.727513+00:00
1ndhrpc,"Konami’s AI project backfires, Yu-Gi-Oh! videos deleted over unauthorized use of popular actress’ voice",,technology,Moth_LovesLamp,45,0.85,0,1757519064.0,https://automaton-media.com/en/news/konamis-ai-project-backfires-yu-gi-oh-videos-deleted-over-unauthorized-use-of-popular-actress-voice/,https://reddit.com/r/technology/comments/1ndhrpc/konamis_ai_project_backfires_yugioh_videos/,Artificial Intelligence,False,False,False,False,False,,2025-09-10T22:32:54.729502+00:00
1ncqmh0,"Apple announces $799 iPhone 17 with bigger 6.3-inch always-on ProMotion screen, A19 chip | This is the first time the regular iPhone has gotten the high-refresh screen.",,technology,ControlCAD,1941,0.89,730,1757441982.0,https://arstechnica.com/gadgets/2025/09/apple-announces-iphone-17-with-bigger-6-3-inch-always-on-promotion-screen-a19-chip/,https://reddit.com/r/technology/comments/1ncqmh0/apple_announces_799_iphone_17_with_bigger_63inch/,Hardware,False,False,False,False,False,,2025-09-10T22:32:55.734447+00:00
1ndofzz,“Bottlebrush” particles deliver big chemotherapy payloads directly to cancer cells,,technology,fchung,17,0.85,3,1757533877.0,https://news.mit.edu/2025/bottlebrush-particles-deliver-big-chemotherapy-payloads-directly-cancer-cells-0909,https://reddit.com/r/technology/comments/1ndofzz/bottlebrush_particles_deliver_big_chemotherapy/,Biotechnology,False,False,False,False,False,,2025-09-10T22:32:56.739979+00:00
1ncu37h,Australia to force porn websites to check users’ ages under new internet rules,,technology,vriska1,1272,0.95,279,1757449560.0,https://www.crikey.com.au/2025/09/09/porn-websites-legally-check-user-age-australia-teen-social-media-ban/,https://reddit.com/r/technology/comments/1ncu37h/australia_to_force_porn_websites_to_check_users/,Net Neutrality,False,False,False,False,False,,2025-09-10T22:32:57.745012+00:00
1nchnf7,"With Looming CBS Hire Of Bari Weiss, Two Of The Four Major U.S. Networks Will Now Be Right Wing Propaganda Mills",,technology,chrisdh79,4379,0.96,183,1757421204.0,https://www.techdirt.com/2025/09/09/with-looming-cbs-hire-of-bari-weiss-two-of-the-four-major-u-s-networks-will-now-be-right-wing-propaganda-mills/,https://reddit.com/r/technology/comments/1nchnf7/with_looming_cbs_hire_of_bari_weiss_two_of_the/,Networking/Telecom,False,False,False,False,False,,2025-09-10T22:32:58.749965+00:00
1nda7wq,"Netherlands investing heavily in producing military drones, sensors, satellites",,technology,boppinmule,75,0.92,2,1757499101.0,https://nltimes.nl/2025/09/10/netherlands-investing-heavily-producing-military-drones-sensors-satellites,https://reddit.com/r/technology/comments/1nda7wq/netherlands_investing_heavily_in_producing/,Business,False,False,False,False,False,,2025-09-10T22:32:59.754978+00:00
1nd6v3t,ICE reactivates contract with previously banned spyware vendor,,technology,rezwenn,148,0.9,3,1757485994.0,https://www.washingtonpost.com/technology/2025/09/02/ice-paragon-spyware-ban-lifted/?pwapi_token=eyJ0eXAiOiJKV1QiLCJhbGciOiJIUzI1NiJ9.eyJyZWFzb24iOiJnaWZ0IiwibmJmIjoxNzU2Nzg1NjAwLCJpc3MiOiJzdWJzY3JpcHRpb25zIiwiZXhwIjoxNzU4MTY3OTk5LCJpYXQiOjE3NTY3ODU2MDAsImp0aSI6IjYxM2IzNjUyLTNmMDAtNDA0Yi1iMWIwLTcyNjAxNzFlNzgzNSIsInVybCI6Imh0dHBzOi8vd3d3Lndhc2hpbmd0b25wb3N0LmNvbS90ZWNobm9sb2d5LzIwMjUvMDkvMDIvaWNlLXBhcmFnb24tc3B5d2FyZS1iYW4tbGlmdGVkLyJ9.jIG3HqREYOu5UjjBBxSFOT3KjU8sc7wjn1GO_zcV_80,https://reddit.com/r/technology/comments/1nd6v3t/ice_reactivates_contract_with_previously_banned/,Privacy,False,False,False,False,False,,2025-09-10T22:33:00.760017+00:00
1ncm9ij,Microsoft mandates a return to office. Three days in the office will soon be the new norm for Microsoft employees.,,technology,indig0sixalpha,2191,0.95,258,1757432281.0,https://www.theverge.com/report/774414/microsoft-return-to-office-policy-announcement,https://reddit.com/r/technology/comments/1ncm9ij/microsoft_mandates_a_return_to_office_three_days/,Business,False,False,False,False,False,,2025-09-10T22:33:01.763582+00:00
1nd80yd,"Intel ousts CEO of Products Michelle Johnston Holthaus as part of the latest executive shake-up, ending 30-year career — company also establishes new custom chip design unit",,technology,ControlCAD,102,0.91,23,1757490541.0,https://www.tomshardware.com/tech-industry/intel-ousts-ceo-of-products-as-part-of-the-latest-executive-shake-up-ending-30-year-career-company-also-establishes-new-custom-chip-design-unit,https://reddit.com/r/technology/comments/1nd80yd/intel_ousts_ceo_of_products_michelle_johnston/,Business,False,False,False,False,False,,2025-09-10T22:33:02.768602+00:00
1ndmkxq,New report shows AI bots are putting kids at risk—what parents can do now,,technology,ubcstaffer123,15,0.79,2,1757529607.0,https://www.mother.ly/parenting/new-report-says-ai-bots-putting-kids-at-risk/,https://reddit.com/r/technology/comments/1ndmkxq/new_report_shows_ai_bots_are_putting_kids_at/,Artificial Intelligence,False,False,False,False,False,,2025-09-10T22:33:03.772953+00:00
1ncnccr,AI is not just ending entry-level jobs. It's the end of the career ladder as we know it,,technology,lurker_bee,1462,0.88,240,1757434694.0,https://www.cnbc.com/2025/09/07/ai-entry-level-jobs-hiring-careers.html,https://reddit.com/r/technology/comments/1ncnccr/ai_is_not_just_ending_entrylevel_jobs_its_the_end/,Society,False,False,False,False,False,,2025-09-10T22:33:04.777966+00:00
1ndg9qb,"Pfizer, BioNTech showcase new data supporting COVID booster as strain LP.8.1 cases rise in California",,technology,upyoars,22,0.78,0,1757515744.0,https://www.biopharmadive.com/news/pfizer-biontech-immunogenicity-data-covid-booster/759504/,https://reddit.com/r/technology/comments/1ndg9qb/pfizer_biontech_showcase_new_data_supporting/,Biotechnology,False,False,False,False,False,,2025-09-10T22:33:05.783039+00:00
1ncfp7s,Trump’s attempt to fire FTC Democrat gets a boost from Supreme Court | John Roberts issuing stay means FTC Democrat has to leave her post again.,,technology,chrisdh79,3511,0.97,177,1757415389.0,https://arstechnica.com/tech-policy/2025/09/supreme-court-chief-justice-lets-trump-fire-ftc-democrat-at-least-for-now/,https://reddit.com/r/technology/comments/1ncfp7s/trumps_attempt_to_fire_ftc_democrat_gets_a_boost/,Politics,False,False,False,False,False,,2025-09-10T22:33:06.787908+00:00
1ncc9di,Trump's Policies Are Shutting Out Americans From the Coolest New Gadgets,,technology,dapperlemon,6653,0.94,412,1757402067.0,https://gizmodo.com/trumps-policies-are-shutting-out-americans-from-the-coolest-new-gadgets-2000655535,https://reddit.com/r/technology/comments/1ncc9di/trumps_policies_are_shutting_out_americans_from/,Business,False,False,False,False,False,,2025-09-10T22:33:07.792871+00:00
1ndhxr1,"Electric school bus bursts into flames, driver and children are okay",,technology,rezwenn,15,0.64,15,1757519437.0,https://www.ctvnews.ca/montreal/article/electric-school-bus-bursts-into-flames-driver-and-children-are-okay/,https://reddit.com/r/technology/comments/1ndhxr1/electric_school_bus_bursts_into_flames_driver_and/,Transportation,False,False,False,False,False,,2025-09-10T22:33:08.796725+00:00
1nddr81,The web has a new system for making AI companies pay up,,technology,Franco1875,20,0.77,5,1757509721.0,https://www.theverge.com/news/775072/rsl-standard-licensing-ai-publishing-reddit-yahoo-medium,https://reddit.com/r/technology/comments/1nddr81/the_web_has_a_new_system_for_making_ai_companies/,Artificial Intelligence,False,False,False,False,False,,2025-09-10T22:33:09.801702+00:00
1ncvia7,AI in schools: St. Paul teacher says it's 'like bringing a forklift to the gym',,technology,ubcstaffer123,390,0.91,102,1757452822.0,https://www.mprnews.org/episode/2025/09/09/ai-in-schools-st-paul-teacher-says-its-like-bringing-a-forklift-to-the-gym,https://reddit.com/r/technology/comments/1ncvia7/ai_in_schools_st_paul_teacher_says_its_like/,Artificial Intelligence,False,False,False,False,False,,2025-09-10T22:33:10.806664+00:00
