id,title,selftext,subreddit,author,score,upvote_ratio,num_comments,created_utc,url,permalink,link_flair_text,is_self,over_18,spoiler,stickied,locked,distinguished,retrieved_at,comments_collected,top_comment_score,avg_comment_score
1neh62x,Right-Wing Activists Are Targeting People for Allegedly Celebrating Charlie Kirk's Death,,technology,Wagamaga,7586,0.88,1375,1757616732.0,https://www.wired.com/story/right-wing-activists-are-targeting-people-for-allegedly-celebrating-charlie-kirks-death/,https://reddit.com/r/technology/comments/1neh62x/rightwing_activists_are_targeting_people_for/,Society,False,False,False,False,False,,2025-09-11T20:25:41.980493+00:00,50,4886,256.4
1ne90uv,Congresswoman Calls on X to Remove Charlie Kirk Assassination Videos: ‘Take Them Down’,,technology,rezwenn,16451,0.89,1878,1757597792.0,https://www.mediaite.com/politics/congresswoman-calls-on-elon-musk-to-remove-charlie-kirk-assassination-videos-take-them-down/,https://reddit.com/r/technology/comments/1ne90uv/congresswoman_calls_on_x_to_remove_charlie_kirk/,Social Media,False,False,False,False,False,,2025-09-11T20:25:45.941022+00:00,50,11132,717.36
1ne8vwy,"Graphic video of Kirk shooting was everywhere online, showing how media gatekeeper role has changed",,technology,rezwenn,10292,0.97,1420,1757597439.0,https://apnews.com/article/charlie-kirk-video-graphic-online-social-media-6cfd4dfde356b960aeea69c01ea3ec34,https://reddit.com/r/technology/comments/1ne8vwy/graphic_video_of_kirk_shooting_was_everywhere/,Social Media,False,False,False,False,False,,2025-09-11T20:25:50.441518+00:00,50,5777,274.98
1nei6ht,GOP lawmaker seeks lifetime bans for social media users celebrating Kirk's assassination,,technology,StraightedgexLiberal,1517,0.92,579,1757619066.0,https://thehill.com/homenews/house/5498536-clay-higgins-targets-charlie-kirk-killing-celebrators/,https://reddit.com/r/technology/comments/1nei6ht/gop_lawmaker_seeks_lifetime_bans_for_social_media/,Social Media,False,False,False,False,False,,2025-09-11T20:25:55.175421+00:00,50,2587,116.84
1nedsij,"Offshore wind has no future in the U.S. under Trump administration, Interior Secretary says",,technology,rezwenn,1989,0.97,213,1757609072.0,https://www.cnbc.com/2025/09/11/offshore-wind-renewables-energy-trump-burgum.html,https://reddit.com/r/technology/comments/1nedsij/offshore_wind_has_no_future_in_the_us_under_trump/,Energy,False,False,False,False,False,,2025-09-11T20:25:58.789619+00:00,50,1144,42.84
1ne4ymh,"'An embarrassing failure of the US patent system': Videogame IP lawyer says Nintendo's latest patents on Pokémon mechanics 'should not have happened, full stop'",,technology,chrisdh79,6134,0.97,231,1757585647.0,https://www.pcgamer.com/gaming-industry/an-embarrassing-failure-of-the-us-patent-system-videogame-ip-lawyer-says-nintendos-latest-patents-on-pokemon-mechanics-should-not-have-happened-full-stop/,https://reddit.com/r/technology/comments/1ne4ymh/an_embarrassing_failure_of_the_us_patent_system/,Business,False,False,False,False,False,,2025-09-11T20:26:01.798285+00:00,50,602,38.9
1ne6rkk,"Addictive algorithms should be illegal, says inventor of the world wide web",,technology,Wagamaga,3790,0.98,87,1757591631.0,https://www.itv.com/news/2025-09-08/addictive-algorithms-should-be-illegal-says-inventor-of-the-world-wide-web,https://reddit.com/r/technology/comments/1ne6rkk/addictive_algorithms_should_be_illegal_says/,Society,False,False,False,False,False,,2025-09-11T20:26:04.360100+00:00,50,134,10.26
1nebktq,Epstein ‘birthday book’ includes apparent letter from former Microsoft CTO Nathan Myhrvold,,technology,biograf_,1701,0.99,26,1757603916.0,https://www.geekwire.com/2025/epstein-birthday-book-includes-apparent-letter-from-former-microsoft-cto-nathan-myhrvold/,https://reddit.com/r/technology/comments/1nebktq/epstein_birthday_book_includes_apparent_letter/,Society,False,False,False,False,False,,2025-09-11T20:26:06.870203+00:00,24,272,28.458333333333332
1ne7k2w,"Misinformation, fear and politics – how a South Dakota county drove away millions in solar energy",,technology,chrisdh79,1823,0.98,70,1757593900.0,https://www.theguardian.com/environment/2025/sep/10/south-dakota-solar-energy,https://reddit.com/r/technology/comments/1ne7k2w/misinformation_fear_and_politics_how_a_south/,Energy,False,False,False,False,False,,2025-09-11T20:26:09.375364+00:00,50,457,36.72
1nebta7,"AI Use at Large Companies Is in Decline, Census Bureau Says",,technology,lurker_bee,1061,0.97,166,1757604469.0,https://gizmodo.com/ai-adoption-declining-at-large-companies-2000655693,https://reddit.com/r/technology/comments/1nebta7/ai_use_at_large_companies_is_in_decline_census/,Business,False,False,False,False,False,,2025-09-11T20:26:11.881224+00:00,50,412,17.22
